{
  "$schema": "../scenario.schema.json",
  "version": 1,
  "id": "rotterdam-aircraft",
  "name": "Rotterdam · aircraft",
  "description": "Synthetic traffic around Rotterdam The Hague Airport.",
  "view": {
    "longitude": 4.437,
    "latitude": 51.956,
    "height": 14000,
    "heading": 0,
    "pitch": -90
  },
  "files": [
    "aircraft.czml"
  ]
}
